Tweet ID,Weight,Total Times Tweeted,Tweet Text
1262338796869296129,0.04012,1,"@jdouglaslittle @jenwagner @kraekerc @CassanoraL @ESL_fairy @berylrcohen @TLMarkides @mrfusco @mkbtuc @BonitaEdu @noasbobs @MsRastin @the_dramamama @ZackTeitel @JBradshaw01 @BBFarhadi @PowerLrn @DrLauraPinto @munakadri @JCasaTodd @RamonaMeharg @rolandvo @heidi_allum @sarahsanders33 @CoachJCummings @CarolCampbell4 @Educhatter @MarciaMentor @Stephen_Hurley @BallantyneCW @aegrant100 @realJ_Mitchell @bizEducator @kayuoit @DerekRhodenizer @WillGourley @sarahdateechur @ericcurts @wterral @lhighfill @MrAmbi_TDSB @ShiftParadigm @MProom31 @DawnTelfer @TaraMartinEDU @JaimeDonally @pdubyatech @tishrich @pauline_bowles @OmarLopez0207 ""The school (in England) has been following strict guidance on social distancing where possible, use of PPE &amp; daily infection control cleaning but despite these rigorous measures, two members of staff have, very regrettably, tested positive for the virus.""
https://t.co/m7isB4vMBl"
1260690347161726976,0.03911,1,"@berylrcohen @jdouglaslittle @kraekerc @CassanoraL @ESL_fairy @TLMarkides @mrfusco @mkbtuc @BonitaEdu @noasbobs @MsRastin @the_dramamama @ZackTeitel @JBradshaw01 @BBFarhadi @PowerLrn @DrLauraPinto @munakadri @JCasaTodd @RamonaMeharg @rolandvo @heidi_allum @sarahsanders33 @CoachJCummings @CarolCampbell4 @Educhatter @MarciaMentor @Stephen_Hurley @BallantyneCW @aegrant100 @realJ_Mitchell @bizEducator @kayuoit @DerekRhodenizer @WillGourley @sarahdateechur @ericcurts @wterral @lhighfill @MrAmbi_TDSB @ShiftParadigm @jenwagner @MProom31 @DawnTelfer @TaraMartinEDU @JaimeDonally @pdubyatech @tishrich @pauline_bowles ""The familiar guidelines to stay six feet from other people to prevent the spread of coronavirus are based on a closed environment. Maintain a longer distance when you're walking &amp; running outside, around 12 to 20 feet."" Dr. Aaron Glatt @MS_SouthNassau
https://t.co/oIXamwecpW"
1262911072543088643,0.0347,1,"@berylrcohen @WenJackwoman @CheroneBest @jdouglaslittle @mariann6668 @the_dramamama @ZackTeitel @JBradshaw01 @noasbobs @BBFarhadi @PowerLrn @DrLauraPinto @munakadri @JCasaTodd @RamonaMeharg @rolandvo @heidi_allum @sarahsanders33 @CoachJCummings @CarolCampbell4 @Educhatter @MarciaMentor @ESL_fairy @Stephen_Hurley @mkbtuc @BallantyneCW @aegrant100 @realJ_Mitchell @Istimrar @MsRastin @banana29 @Jason_To @TLMarkides @Antonettemiglio @Sue_Innovates @swede1pro @mrdanielklein @CassanoraL An illness possibly related to COVID-19 is bringing children to hospitals with symptoms ranging from reddened tongues to rashes &amp; enlarged coronary arteries. Symptoms associated with Kawasaki disease have appeared to cluster in COVID-19.
https://t.co/9GiZgKjgmb"
1263928122392576003,0.03346,1,"@berylrcohen @CoachJCummings @BonitaEdu @jlay02 @fixonted @Educhatter @KimPollishuke @mkbtuc @jdouglaslittle @noasbobs @MsRastin @the_dramamama @ZackTeitel @JBradshaw01 @BBFarhadi @PowerLrn @DrLauraPinto @munakadri @JCasaTodd @RamonaMeharg @rolandvo @heidi_allum @sarahsanders33 @MarciaMentor @ESL_fairy @Stephen_Hurley @BallantyneCW @aegrant100 @realJ_Mitchell @CheroneBest @Istimrar @banana29 @Jason_To @TLMarkides @Antonettemiglio @mariann6668 @Sue_Innovates @swede1pro @WenJackwoman @mrdanielklein @CassanoraL @D2L @YRDSB @yrdsbdlteam @FLVS Thought this group might find this report interesting:
https://t.co/BGcCwOMj2m"
1264373104198860800,0.0321,7,"PERSPECTIVE: We've gone stir crazy at home, and hate wearing a mask. We have Netflix, Grubhub, our pets, and wine. Still a huge adjustment. This is Anne Frank. She and 7 others hid in a 450 sq.ft. attic for 761 days. They were quiet, to remain undiscovered, so as to stay alive. https://t.co/uNXqSvgN3r"
1262130289561739269,0.03099,8,"May 17, 1980, Mt. St. Helens:

Local property owners threaten to run roadblocks at gunpoint, saying lockdown can't last forever, mountain quieting down, geologists exaggerate

WA Gov relents, allows caravan to Spirit Lake

Second caravan to go morning of May 18th.
#MSH40 https://t.co/oThI6CyGuU"
1265330069867769868,0.02994,32,"My daughter lives in Nashville &amp; wore her mask to buy groceries. Guy yells at her: ‘Liberal pussy!’ Back story: she nearly died of H1N1. She was in the ICU for a week, on a ventilator for 3 days. She CANNOT get covid. The ignorance &amp; hatred is so painful. She’s trying to survive."
1265324202065907713,0.02987,1,"Sneak preview of today’s Morning Jolt: Whitmer’s husband wanted his boat in the water early, J.P. Pritzker’s family went to Wisconsin and Florida during lockdown and Ralph Northam was out taking selfies without social distancing or wearing a mask."
1263459892217606144,0.02985,5,"Instead of asking his brother, @NYGovCuomo why he decided to pack COVID patients into nursing homes, killing untold amounts of people, @ChrisCuomo pulled out oversized, prop cotton swabs to mock how big his brother's nose was. This is the state of ""journalism"" on @CNN. Pathetic! https://t.co/undeQMyVeN"
1261568257825308672,0.02975,1,"I want to be clear with Londoners: lockdown has not been lifted. #COVID19 is still an extremely dangerous threat. 
 
Continue to stay at home as much as possible this weekend. If you need to use public transport for essential travel, wear a non-medical face covering at all times."
1261744535673200640,0.02956,1,"Around town
No one wearing a mask
No one social distancing
Nothing closed 'cept bars, eat-in restaurants, hairdressers &amp; our ONE 5 &amp; dime like store
Otherwise life looks normal. 
Yard work, noisy cars, dog walkers&amp; joggers, kids playin, BBQs &amp; Beer on the patio.

Can we work now?"
1263496189791485954,0.02953,7,"Now that I’m a bit more clear headed I can list what Covid has given me up until today. Fevers, rigors, night sweats, shortness of breath, red burning eyes that did bleed from tear ducts, wheezing, relentless headaches, nausea, dry heaves. This is no hoax!"
1264692133497356288,0.02928,17,"I know we are supposed to be cool and above commenting on this, but seeing unmasked people gathering in crowds and flouting social distancing guidelines when I was unable to be present at my mother's burial is so hard. I wish it made me angry—all I feel is deep despair."
1263013689017241600,0.0292,1,Nice to see more places open! A return to real life! Which is about daily life threatening risk! You use a seatbelt to help prevent injury! A mask isn't horrible but why aren't your eyes protected? #Covid19 🤔People drive cars daily &amp; drunk drivers are still a thing? 🤔 media.
1264579188452818944,0.02919,30,"My mother died this morning. I wasn't able to be by her bedside at her memory care facility in Houston to say goodbye, owing to the coronavirus. For those who really believe the news media relishes this state we're in, I ask you to consult what is left of your humanity."
