Tweet ID,Weight,Total Times Tweeted,Tweet Text
1415992091054854147,0.08247,1,"@OttawaDaddy @Anniekidder @KarenLeis3 @kraekerc @JacquieAMiller @lauramccoy01 @berylrcohen @danrosenbergnet @CooganatWindrun @CassanoraL @DaddabboM @mariann6668 @josanchez65 @jhengstler @ESL_fairy @TLMarkides @mrfusco @mkbtuc @jdouglaslittle @BonitaEdu @the_dramamama @ZackTeitel @JBradshaw01 @BBFarhadi @PowerLrn @DrLauraPinto @munakadri @JCasaTodd @RamonaMeharg @rolandvo @heidi_allum @sarahsanders33 @CoachJCummings @CarolCampbell4 @Educhatter @Stephen_Hurley @BallantyneCW @aegrant100 @realJ_Mitchell @bizEducator @kayuoit @liberal_party @jm_mcgrath @fordnation @Sflecce @acampbell99 @OntarioPCParty @AndreaGrebenc @PMOIndia @PeopleforEd The Ministry of Education is expected to release soon its guidelines for the resumption of classes in September, but experts say plans based on immunization rates will be hard to develop without a full picture of vaccination coverage in schools. #OntEd https://t.co/Ck20JpPp1o"
1414918583981850625,0.08213,1,"@KarenLeis3 @OttawaDaddy @kraekerc @JacquieAMiller @lauramccoy01 @berylrcohen @danrosenbergnet @CooganatWindrun @CassanoraL @DaddabboM @mariann6668 @josanchez65 @jhengstler @ESL_fairy @TLMarkides @mrfusco @mkbtuc @jdouglaslittle @BonitaEdu @the_dramamama @ZackTeitel @JBradshaw01 @BBFarhadi @PowerLrn @DrLauraPinto @munakadri @JCasaTodd @RamonaMeharg @rolandvo @heidi_allum @sarahsanders33 @CoachJCummings @CarolCampbell4 @Educhatter @Stephen_Hurley @BallantyneCW @aegrant100 @realJ_Mitchell @bizEducator @kayuoit @liberal_party @jm_mcgrath @fordnation @Sflecce @acampbell99 @OntarioPCParty @AndreaGrebenc @PMOIndia @Anniekidder Should Ontario make the COVID-19 vaccine mandatory for school?:
Karen Littlewood said the union wants the Ontario government to take its direction from health experts, and the union would support those recommendations. 
@melmobarrie #osstf #onted
https://t.co/zi86GQ2Luk"
1415105412232265732,0.08103,1,"@djezck @berylrcohen @catladymom24 @DFisman @ESL_fairy @kraekerc @CassanoraL @RandomSusla @mariann6668 @OttawaDaddy @WhatMeSarcasm @MaskedVulcan @jdouglaslittle @josanchez65 @jhengstler @TLMarkides @mrfusco @mkbtuc @BonitaEdu @the_dramamama @ZackTeitel @JBradshaw01 @BBFarhadi @PowerLrn @DrLauraPinto @munakadri @JCasaTodd @RamonaMeharg @rolandvo @heidi_allum @sarahsanders33 @CoachJCummings @CarolCampbell4 @Educhatter @Stephen_Hurley @BallantyneCW @aegrant100 @realJ_Mitchell @bizEducator @kayuoit @DerekRhodenizer @WillGourley @sarahdateechur @ericcurts @wterral @lhighfill @MrAmbi_TDSB @ShiftParadigm @TBayMOH @D19Harper Kieran Moore said he has seen modelling from Public Health Ontario and the province’s science table that suggests cases will increase when the cooler weather arrives. ""I absolutely expect a rise in COVID activity in September."" #OntEd #SafeSeptember https://t.co/nYgcVPlt9y"
1418189554360721411,0.07714,1,"@kgalmac @RandomSusla @TLMarkides @kraekerc @mariann6668 @JodiKoberinski @OttawaDaddy @CassanoraL @jdouglaslittle @ESL_fairy @berylrcohen @josanchez65 @jhengstler @mrfusco @mkbtuc @the_dramamama @ZackTeitel @JBradshaw01 @BBFarhadi @PowerLrn @DrLauraPinto @munakadri @JCasaTodd @RamonaMeharg @rolandvo @heidi_allum @sarahsanders33 @CoachJCummings @CarolCampbell4 @Educhatter @Stephen_Hurley @BallantyneCW @aegrant100 @realJ_Mitchell @bizEducator @kayuoit @DerekRhodenizer @WillGourley @sarahdateechur @ericcurts @wterral @lhighfill @MrAmbi_TDSB @ShiftParadigm @jenwagner @MProom31 @DawnTelfer @TaraMartinEDU @ajwcarter London academic: We can't let COVID shut down Ontario schools again.
@PrachiSrivas is calling for reform to the province’s curriculum to help mitigate learning loss suffered during the pandemic and for more mental health supports. #onted #SafeSeptember2021 https://t.co/l4YrZmlP5M"
1418189533909245952,0.07631,1,"@ZutBen @DFisman @kraekerc @CassanoraL @berylrcohen @anna_dobie @BonitaEdu @mariann6668 @GeriMossNorbury @ESL_fairy @OttawaDaddy @amelialibertuc1 @jdouglaslittle @danrosenbergnet @DaddabboM @josanchez65 @jhengstler @TLMarkides @mrfusco @mkbtuc @the_dramamama @ZackTeitel @JBradshaw01 @BBFarhadi @PowerLrn @DrLauraPinto @munakadri @JCasaTodd @RamonaMeharg @rolandvo @heidi_allum @sarahsanders33 @CoachJCummings @CarolCampbell4 @Educhatter @Stephen_Hurley @BallantyneCW @aegrant100 @realJ_Mitchell @bizEducator @kayuoit @DerekRhodenizer @stevelanebitch @BriscoeClass @MrsVanKesteren @fordnation @Sflecce @francoislegault @cdube_sante .@PrachiSrivas says it’s “absolutely essential” to get Ontario’s 2M kids back in the classroom this fall, &amp;have them stay there. Brief urges Ontario to implement smaller class sizes, ventilation upgrades &amp;other public health measures to keep schools open. https://t.co/l4YrZmlP5M"
1415992117919367168,0.07595,1,"@OttawaDaddy @Anniekidder @KarenLeis3 @kraekerc @JacquieAMiller @lauramccoy01 @berylrcohen @danrosenbergnet @CooganatWindrun @CassanoraL @DaddabboM @mariann6668 @josanchez65 @jhengstler @ESL_fairy @TLMarkides @mrfusco @mkbtuc @jdouglaslittle @BonitaEdu @the_dramamama @ZackTeitel @JBradshaw01 @BBFarhadi @PowerLrn @DrLauraPinto @munakadri @JCasaTodd @RamonaMeharg @rolandvo @heidi_allum @sarahsanders33 @CoachJCummings @CarolCampbell4 @Educhatter @Stephen_Hurley @BallantyneCW @aegrant100 @realJ_Mitchell @bizEducator @kayuoit @liberal_party @jm_mcgrath @fordnation @Sflecce @acampbell99 @OntarioPCParty @AndreaGrebenc @PMOIndia I’m not worried about whether schools are going to be safe or not.What I am worried about is whether they can be normal in the sense that we can let down some of our public health measures, if we know those schools are vaccinated enough.@PakesGlobal #OntEd https://t.co/Ck20JpPp1o"
1415113209753706498,0.07572,1,"@KarenLeis3 @OttawaDaddy @kraekerc @JacquieAMiller @lauramccoy01 @berylrcohen @danrosenbergnet @CooganatWindrun @CassanoraL @DaddabboM @mariann6668 @josanchez65 @jhengstler @ESL_fairy @TLMarkides @mrfusco @mkbtuc @jdouglaslittle @BonitaEdu @the_dramamama @ZackTeitel @JBradshaw01 @BBFarhadi @PowerLrn @DrLauraPinto @munakadri @JCasaTodd @RamonaMeharg @rolandvo @heidi_allum @sarahsanders33 @CoachJCummings @CarolCampbell4 @Educhatter @Stephen_Hurley @BallantyneCW @aegrant100 @realJ_Mitchell @bizEducator @kayuoit @liberal_party @jm_mcgrath @fordnation @Sflecce @acampbell99 @OntarioPCParty @AndreaGrebenc @PMOIndia @Anniekidder @melmobarrie In Ontario, school-aged children must be immunized against diphtheria, tetanus, polio, measles, mumps, rubella, meningitis and whooping cough — unless they have a valid exemption. 
Should Ontario make the COVID-19 vaccine mandatory for school? #onted #etfo #osstf #oecta #tdsb"
1418189571821654016,0.07472,1,"@kgalmac @RandomSusla @TLMarkides @kraekerc @mariann6668 @JodiKoberinski @OttawaDaddy @CassanoraL @jdouglaslittle @ESL_fairy @berylrcohen @josanchez65 @jhengstler @mrfusco @mkbtuc @the_dramamama @ZackTeitel @JBradshaw01 @BBFarhadi @PowerLrn @DrLauraPinto @munakadri @JCasaTodd @RamonaMeharg @rolandvo @heidi_allum @sarahsanders33 @CoachJCummings @CarolCampbell4 @Educhatter @Stephen_Hurley @BallantyneCW @aegrant100 @realJ_Mitchell @bizEducator @kayuoit @DerekRhodenizer @WillGourley @sarahdateechur @ericcurts @wterral @lhighfill @MrAmbi_TDSB @ShiftParadigm @jenwagner @MProom31 @DawnTelfer @TaraMartinEDU @ajwcarter “Harms are real &amp; not to be underestimated in terms of children’s health &amp;well-being &amp; overall life opportunities,” said @PrachiSrivas. Ontario has experienced 28 wks of school closures or disruptions during pandemic, most of all Canadian provinces. #onted https://t.co/l4YrZmlP5M"
1417602087303663616,0.07241,1,@DrKateTO @vauvent @AnneLeBlanc2 @kraekerc @CassanoraL @OttawaDaddy @ESL_fairy @amelialibertuc1 @jdouglaslittle @BonitaEdu @danrosenbergnet @DaddabboM @mariann6668 @josanchez65 @jhengstler @berylrcohen @TLMarkides @mrfusco @mkbtuc @the_dramamama @ZackTeitel @JBradshaw01 @BBFarhadi @PowerLrn @DrLauraPinto @munakadri @JCasaTodd @RamonaMeharg @rolandvo @heidi_allum @sarahsanders33 @CoachJCummings @CarolCampbell4 @Educhatter @Stephen_Hurley @BallantyneCW @aegrant100 @realJ_Mitchell @bizEducator @kayuoit @DerekRhodenizer @WillGourley @sarahdateechur @ericcurts @wterral @lhighfill @MrAmbi_TDSB @ShiftParadigm @AmerAcadPeds @allisonjones_cp Ontario's CMOH says he's not sure there will be high enough levels of immunity to COVID-19 by Sept for kids to return to school unmasked.  He would define low risk in that context as a community that is seeing fewer than 10 cases per 100K people per week. https://t.co/WzNr6mW6Ih
1418186056629985281,0.06975,1,"@kraekerc @danrosenbergnet @CassanoraL @Maria_L_O @katieavery @ispeakdaggers @stangea @berylrcohen @ESL_fairy @jdouglaslittle @the_dramamama @DrLauraPinto @mariann6668 @ZackTeitel @JBradshaw01 @BBFarhadi @PowerLrn @munakadri @JCasaTodd @RamonaMeharg @rolandvo @heidi_allum @sarahsanders33 @CoachJCummings @CarolCampbell4 @Educhatter @Stephen_Hurley @mkbtuc @BallantyneCW @aegrant100 @realJ_Mitchell @CheroneBest @Istimrar @banana29 @Jason_To @TLMarkides @Antonettemiglio @Sue_Innovates @swede1pro @WenJackwoman @mrdanielklein @heidi_yetman @qesba @krushowy @tdsb @CanvasLMS @ONeducation @la_FAE Ontario experts call for updated COVID-19 screening, school attendance policies: In both low-risk &amp; moderate-risk scenarios, experts are recommending fully vaccinated people wouldn’t have to stay home from school if exposed to a COVID-19 case. #onted https://t.co/Cq54puXtKe"
1418188249768632328,0.06278,1,"@kraekerc @danrosenbergnet @CassanoraL @Maria_L_O @katieavery @ispeakdaggers @stangea @berylrcohen @ESL_fairy @jdouglaslittle @the_dramamama @DrLauraPinto @mariann6668 @ZackTeitel @JBradshaw01 @BBFarhadi @PowerLrn @munakadri @JCasaTodd @RamonaMeharg @rolandvo @heidi_allum @sarahsanders33 @CoachJCummings @CarolCampbell4 @Educhatter @Stephen_Hurley @mkbtuc @BallantyneCW @aegrant100 @realJ_Mitchell @CheroneBest @Istimrar @banana29 @Jason_To @TLMarkides @Antonettemiglio @Sue_Innovates @swede1pro @WenJackwoman @mrdanielklein @heidi_yetman @qesba @krushowy @tdsb @CanvasLMS @ONeducation @la_FAE Those scenarios also contemplate dropping the requirement for ss to stay home if anyone in their household has a symptom. In high-risk situation, they recommend not needing to keep students home if family member with a symptom is fully vaccinated. #onted https://t.co/Cq54puXtKe"
1415992189625282563,0.06065,1,"@R43257819 @jhengstler @kraekerc @jdouglaslittle @BonitaEdu @TLMarkides @CassanoraL @mkbtuc @the_dramamama @ZackTeitel @JBradshaw01 @BBFarhadi @PowerLrn @DrLauraPinto @munakadri @JCasaTodd @RamonaMeharg @rolandvo @heidi_allum @sarahsanders33 @CoachJCummings @CarolCampbell4 @Educhatter @ESL_fairy @Stephen_Hurley @BallantyneCW @berylrcohen @aegrant100 @realJ_Mitchell @CheroneBest @DiEliscia @zbpipe @HynesKatelin @THOMLYNN101 @Axeman1962 @jioannides @LeighCassell @ontteacher01 @wliu17 @MrRuggero @aforgrave @DanaeDiamant @rchids @aliciajpascual @socialjusticete @dcarruthersedu @maritstiles @LauraMaeLindo @karenosstf “Without use of math as a tool to uncover social issues, police carding would continue to further damage Black &amp;Indigenous communities,climate change would be even more out of control, &amp;COVID19 responses would not have prioritized those in highest-risk neighbourhoods."" @Jason_To"
1414344639063146498,0.05425,1,"@Educhatter @jhengstler @SharkawyMD @ZackTeitel @rolandvo @CarolCampbell4 @Istimrar @Henry_Hepburn @acampbell99 @Sue_Innovates @ESL_fairy @JBradshaw01 @BBFarhadi @PowerLrn @DrLauraPinto @munakadri @JCasaTodd @RamonaMeharg @heidi_allum @sarahsanders33 @CoachJCummings @Stephen_Hurley @mkbtuc @BallantyneCW @calphonso @Anniekidder @krushowy @ColinDMello @DFisman @CT_Bergstrom @jkwan_md @c_drosten @DocTrott @BogochIsaac @JulieCh31944541 @mlipsitch @aetiology @trvrb @BhadeliaMD @KizzyPhD @T_Inglesby @VirusesImmunity @ashishkjha @KrutikaKuppalli @AdamJKucharski @AndreaGrebenc @CDCgov @AshTuite @etfopresident Children under age of 12 now make up the single largest cohort of unvaccinated Canadians, due to their ineligibility to get vaccinated.
""Almost all the outbreaks are going to be among  school population, because that is the susceptible population."" #onted https://t.co/JvRZoVm51h"
1418069160655998976,0.05096,12,"I repeat: WE ARE SELLING OUT.  

McKinsey &amp; Company contracted to manage @fordnation COVID-19 response (1.6M) including 2020 school reopening (+3.6M) EXPLICITLY prescribe the use of CRISIS to marketize and exploit public schools for private gain. #OntEd
https://t.co/JkJLyNomrW https://t.co/GWfK8ucAIj https://t.co/4v0iT363pt"
1418164597819908103,0.04956,8,"Outrageous! @McKinsey was paid ‘$1.6M to turn Ontario’s pandemic health table into a “command table” filled by business leaders after a cold call to Ford’s office last March’, and then $3.2M to advise on school reopening. Policy advice should come from public servants! #onpoli https://t.co/FXlQ4hv1uX"
